Input; Output1; Output2; Output3; Output4; Output5; Output6; Output7; Output8; Output9; Output10; Score1; Score2; Score3; Score4; Score5; Score6; Score7; Score8; Score9; Score10
trabajo; trabajadora; femenina; mujer; autora; madre; española; misma; la; compañera; rica; 0.13348; 0.06849; 0.06549; 0.02674; 0.02664; 0.02218; 0.01794; 0.01509; 0.01476; 0.01416
inteligencia; mujer; belleza; femenina; autora; inteligencia; escritora; española; bella; misma; hija; 0.12662; 0.0892; 0.08736; 0.05653; 0.04775; 0.03827; 0.0234; 0.01983; 0.01618; 0.01554
rey; reina; mujer; hija; dama; española; india; negra; Isabel; francesa; italiana; 0.61651; 0.03124; 0.03085; 0.02637; 0.02519; 0.02455; 0.01444; 0.01274; 0.00898; 0.00895
programador; escritora; actriz; autora; diseñadora; creadora; creativa; española; femenina; directora; mujer; 0.20544; 0.11457; 0.06867; 0.06653; 0.02569; 0.0247; 0.02142; 0.02124; 0.01733; 0.0158
medico; doctora; enfermera; escritora; madre; mujer; profesora; médica; actriz; científica; argentina; 0.25077; 0.0768; 0.03767; 0.03187; 0.02671; 0.02557; 0.02354; 0.01936; 0.0184; 0.01837
muebles; catalana; muebles; abierta; Nuria; Lola; casa; artística; desnuda; bonita; Laura; 0.04719; 0.03598; 0.03314; 0.02504; 0.02321; 0.02238; 0.01666; 0.01611; 0.01565; 0.01546
fidelidad; femenina; mujer; madre; española; la; fidelidad; abierta; ella; hija; Sofía; 0.05125; 0.02875; 0.02581; 0.02464; 0.02351; 0.02149; 0.02134; 0.02122; 0.01927; 0.01895
experto; experta; rica; española; femenina; amiga; escritora; autora; madura; mujer; india; 0.46777; 0.04102; 0.02202; 0.02054; 0.01756; 0.01522; 0.01307; 0.01292; 0.0126; 0.00989
amor; mujer; femenina; amiga; madre; dama; belleza; hija; bella; mia; española; 0.14552; 0.12501; 0.03865; 0.03289; 0.02839; 0.0255; 0.02023; 0.01538; 0.01526; 0.01504
casa; casa; la; ella; amiga; madre; mia; argentina; bonita; Laura; española; 0.50683; 0.04236; 0.02037; 0.0199; 0.01438; 0.01307; 0.01056; 0.00722; 0.00693; 0.00596
embajador; embajadora; actriz; amiga; escritora; española; Isabel; india; brasileña; autora; Cristina; 0.05914; 0.04869; 0.04415; 0.04297; 0.03653; 0.03307; 0.02332; 0.01809; 0.01775; 0.01504
ligon; femenina; francesa; italiana; bella; española; negra; rica; amiga; mujer; actriz; 0.13848; 0.03771; 0.03739; 0.03171; 0.03137; 0.02746; 0.0271; 0.02641; 0.02433; 0.02341
espabilado; femenina; española; madura; catalana; bonita; negra; abierta; mujer; francesa; madre; 0.27953; 0.06143; 0.04559; 0.02281; 0.01862; 0.01715; 0.01617; 0.0161; 0.01591; 0.01483
adinerado; rica; femenina; francesa; española; italiana; negra; mujer; japonesa; africana; trabajadora; 0.46826; 0.05279; 0.04695; 0.03944; 0.02077; 0.01754; 0.0124; 0.01221; 0.01169; 0.01148
rico; rica; negra; bella; española; mujer; francesa; hermosa; bonita; trabajadora; madre; 0.75583; 0.0754; 0.02139; 0.00794; 0.00541; 0.00532; 0.0052; 0.00486; 0.00483; 0.00442
engaÃ±o; femenina; amiga; mujer; bonita; la; otra; madre; autora; ella; hija; 0.07117; 0.03343; 0.03184; 0.02879; 0.026; 0.02399; 0.02374; 0.02355; 0.02089; 0.02035
conducir; femenina; la; madre; ella; mujer; italiana; embarazada; escritora; Laura; conductora; 0.0624; 0.03914; 0.03661; 0.02707; 0.02349; 0.02245; 0.01986; 0.01958; 0.01934; 0.01816
azul; negra; roja; blanca; rosa; Blanca; Roja; italiana; rusa; rubia; dorada; 0.33356; 0.304; 0.23976; 0.01853; 0.01157; 0.00908; 0.00486; 0.00415; 0.0035; 0.00269
rosa; negra; blanca; roja; rosa; femenina; Rosa; rusa; india; italiana; japonesa; 0.42848; 0.17292; 0.11726; 0.06598; 0.01363; 0.01336; 0.01001; 0.00882; 0.00783; 0.00646
deporte; mujer; femenina; española; política; estética; madre; actriz; bella; belleza; artística; 0.11436; 0.1053; 0.03132; 0.02849; 0.02115; 0.01771; 0.01573; 0.01531; 0.01448; 0.01442
fiel; femenina; amiga; bella; tierna; bonita; casada; española; ella; abierta; mujer; 0.13025; 0.08702; 0.05852; 0.03516; 0.03183; 0.02616; 0.02267; 0.02199; 0.02182; 0.02155
abogado; escritora; abogada; actriz; mujer; madre; española; negra; argentina; catalana; autora; 0.09493; 0.0901; 0.06285; 0.05946; 0.04487; 0.03525; 0.02756; 0.02323; 0.01979; 0.01598
amor; mujer; femenina; amiga; madre; dama; belleza; hija; bella; mia; española; 0.14552; 0.12501; 0.03865; 0.03289; 0.02839; 0.0255; 0.02023; 0.01538; 0.01526; 0.01504
homosexual; lesbiana; femenina; española; mujer; negra; musulmana; italiana; francesa; escritora; india; 0.18565; 0.11821; 0.09402; 0.04591; 0.03579; 0.02936; 0.0247; 0.02265; 0.01937; 0.01906
pasatiempo; femenina; mujer; dama; escritora; actriz; amiga; chica; autora; compañera; madre; 0.14735; 0.10892; 0.03859; 0.0385; 0.03655; 0.03502; 0.03097; 0.01816; 0.01432; 0.0123
regalo; amiga; madre; mujer; autora; embarazada; ella; femenina; Lola; Navidad; dama; 0.06422; 0.04692; 0.0372; 0.0351; 0.0202; 0.02017; 0.02014; 0.02; 0.01895; 0.01807
vicio; abierta; madre; belleza; femenina; ella; muerte; mujer; la; española; hija; 0.05695; 0.03184; 0.0276; 0.02654; 0.02501; 0.02453; 0.02345; 0.0231; 0.02039; 0.01672
droga; mujer; madre; negra; hija; femenina; española; embarazada; argentina; asesina; misma; 0.06858; 0.05183; 0.04787; 0.04158; 0.02304; 0.02273; 0.02152; 0.01909; 0.01644; 0.0158
adicciÃ³n; femenina; mujer; la; madre; misma; escritora; actriz; ella; autora; japonesa; 0.127; 0.10633; 0.03088; 0.02753; 0.02571; 0.0195; 0.01786; 0.01658; 0.0161; 0.01494
prioridad; actriz; política; femenina; mujer; española; maternidad; Isabel; escritora; mia; autora; 0.04605; 0.03254; 0.03118; 0.02642; 0.02445; 0.02279; 0.02197; 0.01811; 0.01715; 0.0168
objeto; mujer; femenina; dama; autora; madre; actriz; hija; amiga; muerta; trabajadora; 0.3487; 0.11183; 0.04735; 0.04334; 0.04064; 0.02806; 0.02564; 0.01757; 0.01741; 0.01375
arte; femenina; mujer; belleza; autora; artística; escritora; estética; bella; española; madre; 0.1223; 0.11675; 0.08623; 0.05383; 0.0441; 0.03286; 0.02965; 0.01972; 0.01842; 0.01368
vida; vida; mujer; misma; hija; muerte; madre; escritora; femenina; mía; autora; 0.16896; 0.09308; 0.04948; 0.04116; 0.02945; 0.0286; 0.0239; 0.02299; 0.02094; 0.01902
vivir; la; muerte; ella; vida; madre; Isabel; Ella; misma; vivir; escritora; 0.05261; 0.03122; 0.02799; 0.02453; 0.02097; 0.01907; 0.0186; 0.01788; 0.01701; 0.01695
jugar; bailar; divertirse; la; femenina; ella; jugar; disfrutar; argentina; otra; casa; 0.04526; 0.03788; 0.03718; 0.03076; 0.03015; 0.02155; 0.02043; 0.01808; 0.01609; 0.01379
cocinar; cocinar; cocinera; madre; la; ella; femenina; Lola; española; cocina; catalana; 0.13902; 0.05391; 0.03406; 0.02444; 0.02002; 0.01967; 0.01967; 0.01783; 0.0149; 0.0147
intimidad; intimidad; íntima; femenina; mujer; mía; misma; abierta; amiga; autora; mia; 0.13836; 0.06394; 0.05266; 0.04753; 0.02946; 0.02736; 0.01934; 0.01841; 0.01735; 0.01559
cama; misma; mia; cama; casa; española; femenina; la; mujer; abierta; negra; 0.03431; 0.03205; 0.02491; 0.02446; 0.02429; 0.02304; 0.0227; 0.02123; 0.02087; 0.01987
embajada; amiga; india; escritora; femenina; mujer; cubana; Isabel; hija; japonesa; española; 0.05815; 0.05255; 0.02543; 0.02162; 0.02135; 0.02017; 0.01938; 0.01908; 0.01875; 0.01862
familia; madre; hija; familia; amiga; mujer; hermana; española; casa; mia; misma; 0.13058; 0.07373; 0.06719; 0.06372; 0.04693; 0.04209; 0.03615; 0.02709; 0.01691; 0.01566
hijos; hija; madre; hijos; Isabel; mujer; embarazada; Juana; hijas; ella; mamá; 0.30217; 0.13482; 0.03587; 0.02753; 0.0221; 0.01983; 0.01722; 0.01568; 0.01307; 0.01214
matrimonio; mujer; casada; madre; hija; española; dama; femenina; esposa; otra; la; 0.07813; 0.06013; 0.04354; 0.03119; 0.02923; 0.0268; 0.02553; 0.01996; 0.01791; 0.01715
dinero; mujer; madre; femenina; mujeres; ella; la; hija; española; Ella; otra; 0.13645; 0.04974; 0.04828; 0.03788; 0.0352; 0.02737; 0.02137; 0.01487; 0.01481; 0.0145
supervivencia; femenina; naturaleza; autora; mujer; muerte; escritora; maternidad; misma; madre; vida; 0.043; 0.0414; 0.0399; 0.03613; 0.02695; 0.02459; 0.0244; 0.02343; 0.02307; 0.02296
astucia; bella; dama; bonita; española; femenina; hermosa; negra; rica; mujer; romántica; 0.11642; 0.05833; 0.05059; 0.04499; 0.03547; 0.02381; 0.02201; 0.02194; 0.01905; 0.01766
fuerza; femenina; mujer; autora; misma; Isabel; española; dama; trabajadora; mia; Luisa; 0.09117; 0.07364; 0.02882; 0.02809; 0.02218; 0.02128; 0.02105; 0.02002; 0.01862; 0.01623
rebelde; femenina; abierta; amiga; española; mujer; madre; bella; hija; catalana; divertida; 0.10898; 0.06067; 0.03305; 0.03279; 0.02263; 0.02122; 0.02105; 0.01609; 0.01519; 0.0144
